{
  "schema_version": "1.0.0",
  "decision_trace_id": "dt-2026-09-25-0001",
  "decision_case_id": "dc-2026-09-25-0001",
  "org_id": "org_acme",
  "plant_id": "plant_ghaziabad_1",
  "lockfile_hash": "sha256:aaaaaaaaaaaaaaaaaaaaaaaaaaaaaaaaaaaaaaaaaaaaaaaaaaaaaaaaaaaaaaaa",
  "kernel_version": "l4-kernel.v1",
  "correlation_id": "corr-2026-09-25-0001",
  "condition_key": "ck:md_overlap:incomer_1:2026-06-15T06:00:00Z/2026-06-15T07:00:00Z",
  "terminal": {
    "status": "emit",
    "card_proposal_id": "cp-2026-09-25-0001"
  },
  "observed": {
    "origin": "l3_finding",
    "finding_refs": ["f-2026-07-08-0042"],
    "detector_id": "det.md_overlap",
    "detector_version": "1.0.0",
    "condition_key": "ck:md_overlap:incomer_1:2026-06-15T06:00:00Z/2026-06-15T07:00:00Z",
    "psm_snapshot_id": "psm-2026-09-25T04:00:00Z",
    "coverage_manifest": {
      "included": ["incomer_1", "furnace_1"],
      "unknown": ["feeder_west"]
    }
  },
  "context": {
    "evidence_ledger_hash": "sha256:cccccccccccccccccccccccccccccccccccccccccccccccccccccccccccccccc",
    "frozen_memory_row_ids": ["mem-case-12"],
    "proof_obligations": {
      "required": ["asset_bind", "verification_path"],
      "met": ["asset_bind", "verification_path"]
    }
  },
  "action": {
    "footprint": {
      "asset_ids": ["incomer_1", "furnace_1"],
      "shared_resource_ids": ["feeder_main"],
      "crew_role": "utilities_lead",
      "time_window": "2026-09-25T14:00:00Z/2026-09-25T16:00:00Z"
    },
    "card_proposal_id": "cp-2026-09-25-0001"
  },
  "policy": {
    "lockfile_hash": "sha256:aaaaaaaaaaaaaaaaaaaaaaaaaaaaaaaaaaaaaaaaaaaaaaaaaaaaaaaaaaaaaaaa",
    "constraint_results": [
      {
        "constraint_ref": "cstr.min_header_bar",
        "result": "satisfied"
      }
    ],
    "gate_records": [
      {
        "gate_id": "proof_floor",
        "gate_class": "hard",
        "fired": false
      }
    ],
    "portfolio_action": "pass"
  },
  "created_at": "2026-09-25T04:02:11Z"
}
